{"artifact_kind":"claim_candidate","candidate_id":"candidate-eebe2f6f6db5adde34bbd07aacc444c3b2590140c5dedae46f63148d6b9961a3","canonical_payload_sha256":"eebe2f6f6db5adde34bbd07aacc444c3b2590140c5dedae46f63148d6b9961a3","payload":{"authority":["synthetic fixture reviewer"],"bindings":[{"claim_id":"accuracy-reported","evidence_id":"sample-accuracy","role":"supports"}],"claims":[{"claim_id":"accuracy-reported","element_ref":{"component_id":"results","element_id":"accuracy"},"material":true,"rationale":"Synthetic reviewer matched the statement to the source line.","statement":"The stored sample reports accuracy 0.91.","status":"supported"}],"evidence_items":[{"evidence_id":"sample-accuracy","locator":{"end":1,"kind":"line_range","start":1},"method":"inspected","observed_summary":"The stored sample reports accuracy 0.91.","source":{"kind":"file","path":"evidence/support.txt"}}],"limitations":[],"objective":"Inspect a synthetic accuracy statement.","schema_version":"2.0","scope":["evidence/support.txt"],"summary":{"claim_boundary_ids":[],"no_supported_claim":false,"strongest_safe_claim_id":"accuracy-reported"},"unresolved_uncertainties":["Synthetic example does not establish held-out accuracy."]},"provenance":{"bundle":{"bundle_id":"nomination-49f67d2c1a22692aaa1a104905ab3c1ecc3eceebdb4bd78b7a5f99da9d2e78a5","canonical_payload_sha256":"49f67d2c1a22692aaa1a104905ab3c1ecc3eceebdb4bd78b7a5f99da9d2e78a5","file_sha256":"f07dc81c97021871c597dd40c2dd3482503b997e24c60d08ceba57129ac6afa8"},"map":{"canonical_payload_sha256":"d32556108562f6315e03fac06e26a72953ba4206710e1c46d902674c62e1255a","file_sha256":"a6ce09d4104002cb1b3b54e80fc1eec377c367ea1445f0e4c310d1521f1f4042","map_id":"component-map-5fc2185d6b5c"},"selected_nomination_ids":["hit-dec45e34c73443994d85538b9817df71d3afdbe8d754a1bf0cec36caa04807e8"],"selection_sha256":"25bd629719a200911afd1c9a2151af9888d6a46a94e34658b2d5c9c2a3fd4677","target":{"claim_digest":"c47b7d04b6b021e5f11dede66072e221c228cc713701ace7c6c43beac54266b2","claim_id":"accuracy-reported","element_ref":{"component_id":"results","element_id":"accuracy"},"kind":"claim","record_sha256":"fe1415de26cee4264367a6c0c7a0b3691ea806f9ef89b2262ce881ab8e0ec8f3","scan_id":"20260915T164021108533Z-da06786e"}},"schema_version":"1.0"}
